{
  "id": "set_yousuke-yukimatsu_yousuke-yukimatsu-keep-hush",
  "title": "YOUSUKE YUKIMATSU - Keep Hush Live",
  "artist": "Yousuke Yukimatsu",
  "venue": "Keep Hush",
  "audio_url": "https://soundcloud.com/lord-flue/yousuke-yukimatsu-keep-hush",
  "youtube_url": "https://www.youtube.com/watch?v=WyX-PRqzV78",
  "source_url": "https://set79.com/tracklist/soundcloud.com/lord-flue/yousuke-yukimatsu-keep-hush",
  "source_platform": "set79",
  "parsed_at": "2026-06-29T20:44:42.244740Z",
  "enriched_at": "2026-06-29T21:01:38Z",
  "tracks": [
    {
      "position": 1,
      "title": "Msmsmsm",
      "artist": "SOPHIE",
      "timecode": "00:02:48",
      "start_sec": 168,
      "audio": {
        "bpm": 136.0,
        "key": "E minor",
        "camelot": "9A",
        "key_strength": 0.7807,
        "energy": 0.0661,
        "danceability": 0.808,
        "loudness": -14.4,
        "mfcc_mean": [
          -147.52,
          128.58,
          -5.73,
          39.02,
          -18.4,
          25.18,
          -8.27,
          13.21,
          -2.75,
          6.75,
          2.54,
          2.56,
          4.8
        ],
        "beat_positions": [
          0.406,
          0.824,
          1.231,
          1.66,
          2.09,
          2.531,
          2.972,
          3.413,
          3.855,
          4.296,
          4.737,
          5.178,
          5.631,
          6.084,
          6.525,
          6.966,
          7.407,
          7.86,
          8.313,
          8.754,
          9.195,
          9.636,
          10.077,
          10.519,
          10.96,
          11.413,
          11.865,
          12.307,
          12.748,
          13.189,
          13.63,
          14.071,
          14.512,
          14.954,
          15.406,
          15.859,
          16.3,
          16.742,
          17.183,
          17.624,
          18.077,
          18.53,
          18.971,
          19.412,
          19.865,
          20.317,
          20.759,
          21.2,
          21.653,
          22.105,
          22.547,
          22.988,
          23.429,
          23.87,
          24.311,
          24.764,
          25.217,
          25.658,
          26.099,
          26.54,
          26.982,
          27.423,
          27.876,
          28.328,
          28.77,
          29.211,
          29.652,
          30.093,
          30.534,
          30.975,
          31.417,
          31.869,
          32.322,
          32.763,
          33.205,
          33.646,
          34.087,
          34.54,
          34.992,
          35.434,
          35.875,
          36.316,
          36.757,
          37.198,
          37.64,
          38.092,
          38.534,
          38.975,
          39.427,
          39.869,
          40.31,
          40.751,
          41.204,
          41.657,
          42.098,
          42.539,
          42.98,
          43.433,
          43.886,
          44.327,
          44.768,
          45.209,
          45.65,
          46.092,
          46.533,
          46.986,
          47.427,
          47.868,
          48.321,
          48.762,
          49.203,
          49.644,
          50.097,
          50.55,
          50.991,
          51.432,
          51.873,
          52.315,
          52.756,
          53.209,
          53.65,
          54.091,
          54.532,
          54.973,
          55.426,
          55.867,
          56.308,
          56.75,
          57.202,
          57.655,
          58.096,
          58.538,
          58.979,
          59.431,
          59.873,
          60.314,
          60.767,
          61.208,
          61.649,
          62.09,
          62.531,
          62.984,
          63.437,
          63.878,
          64.319,
          64.76,
          65.202,
          65.631,
          66.061,
          66.502,
          66.955,
          67.396,
          67.849,
          68.301,
          68.754,
          69.195,
          69.637,
          70.089,
          70.542,
          70.983,
          71.425,
          71.866,
          72.307,
          72.748,
          73.189,
          73.63,
          74.072,
          74.559,
          75.047,
          75.535,
          76.022,
          76.51,
          76.997,
          77.555,
          78.112,
          78.669,
          79.215,
          79.761,
          80.353,
          80.956,
          81.548,
          82.141,
          82.733,
          83.325,
          83.929,
          84.532,
          85.136,
          85.751,
          86.367,
          86.982,
          87.586,
          88.189,
          88.793,
          89.42,
          90.047,
          90.72,
          91.382,
          92.044,
          92.775,
          93.507
        ]
      },
      "meta": {
        "label": "Numbers.",
        "release": "Sophie (42) - Msmsmsm / Vyzee",
        "year": 2015,
        "genres": [
          "Electronic",
          "Pop",
          "Dance-pop",
          "Experimental",
          "Hyperpop",
          "Deconstructed Club",
          "Bass Music",
          "Trap",
          "Bubblegum",
          "Electro",
          "House",
          "Abstract",
          "Leftfield"
        ],
        "discogs_url": "https://www.discogs.com/release/7795993",
        "source": "discogs"
      }
    },
    {
      "position": 2,
      "title": "Wa1023",
      "artist": "Slikback",
      "timecode": "00:06:24",
      "start_sec": 384,
      "audio": {
        "bpm": 139.7,
        "key": "F minor",
        "camelot": "4A",
        "key_strength": 0.7796,
        "energy": 0.0717,
        "danceability": 0.819,
        "loudness": -11.5,
        "mfcc_mean": [
          -52.04,
          149.48,
          -61.45,
          38.05,
          -16.75,
          21.96,
          -7.47,
          17.15,
          -7.05,
          17.48,
          2.41,
          4.02,
          4.16
        ],
        "beat_positions": [
          0.418,
          0.848,
          1.277,
          1.707,
          2.148,
          2.577,
          2.995,
          3.425,
          3.855,
          4.284,
          4.714,
          5.143,
          5.573,
          6.014,
          6.432,
          6.861,
          7.291,
          7.709,
          8.139,
          8.58,
          9.009,
          9.427,
          9.857,
          10.286,
          10.716,
          11.146,
          11.564,
          11.993,
          12.423,
          12.852,
          13.282,
          13.711,
          14.141,
          14.571,
          15.0,
          15.43,
          15.859,
          16.277,
          16.707,
          17.136,
          17.566,
          17.995,
          18.425,
          18.855,
          19.284,
          19.714,
          20.143,
          20.573,
          21.014,
          21.467,
          21.92,
          22.372,
          22.825,
          23.266,
          23.708,
          24.126,
          24.555,
          24.985,
          25.414,
          25.844,
          26.273,
          26.703,
          27.133,
          27.562,
          27.98,
          28.41,
          28.839,
          29.269,
          29.698,
          30.128,
          30.557,
          30.987,
          31.417,
          31.846,
          32.276,
          32.705,
          33.135,
          33.564,
          33.994,
          34.424,
          34.865,
          35.294,
          35.736,
          36.177,
          36.618,
          37.059,
          37.5,
          37.918,
          38.348,
          38.777,
          39.219,
          39.648,
          40.078,
          40.519,
          40.937,
          41.355,
          41.784,
          42.214,
          42.632,
          43.073,
          43.491,
          43.921,
          44.35,
          44.78,
          45.198,
          45.627,
          46.068,
          46.498,
          46.928,
          47.357,
          47.787,
          48.205,
          48.634,
          49.064,
          49.505,
          49.946,
          50.364,
          50.794,
          51.223,
          51.641,
          52.059,
          52.489,
          52.918,
          53.348,
          53.777,
          54.207,
          54.637,
          55.055,
          55.484,
          55.914,
          56.355,
          56.784,
          57.214,
          57.644,
          58.073,
          58.503
        ]
      },
      "meta": {
        "label": "Not On Label (Slikback Self-released)",
        "release": "Slikback - ///",
        "year": 2020,
        "genres": [
          "Electronic",
          "Hip Hop",
          "Experimental",
          "Abstract",
          "Juke",
          "Grime",
          "Bass Music",
          "Trap",
          "Noise"
        ],
        "discogs_url": "https://www.discogs.com/release/15887206",
        "source": "discogs"
      }
    },
    {
      "position": 3,
      "title": "XAllegroX",
      "artist": "Lorenzo Senni",
      "timecode": "00:07:48",
      "start_sec": 468,
      "audio": {
        "bpm": 168.6,
        "key": "C major",
        "camelot": "8B",
        "key_strength": 0.8196,
        "energy": 0.1049,
        "danceability": 0.6819,
        "loudness": -20.8,
        "mfcc_mean": [
          -192.71,
          66.71,
          -23.05,
          31.96,
          -34.48,
          40.5,
          -10.39,
          20.56,
          -10.93,
          12.2,
          3.13,
          6.13,
          5.59
        ],
        "beat_positions": [
          0.36,
          0.755,
          1.138,
          1.533,
          1.95,
          2.368,
          2.798,
          3.228,
          3.669,
          4.087,
          4.516,
          4.946,
          5.375,
          5.793,
          6.223,
          6.653,
          7.082,
          7.512,
          7.941,
          8.371,
          8.8,
          9.23,
          9.66,
          10.077,
          10.403,
          10.739,
          11.088,
          11.447,
          11.796,
          12.121,
          12.446,
          12.771,
          13.084,